{
  "schema_version": 1,
  "id": "noop-carro-chefe-main",
  "workbook": {
    "path": "anexos/financeiro/carro chefe.xlsm",
    "expected_sha256": "7bd4a3defe4173f361c07ca4ee98da43654bd8f9d0724f5ad9ee1374965701c1",
    "expected_vba_sha256": "b8fa98985cdd1abd7d2d05b1cb7efabf79a8b83399136039dd040a4d6604b0cf"
  },
  "operations": [
    {
      "op": "assert.table",
      "table": "CaProdutos",
      "expected_ref": "B4:M47"
    }
  ]
}
