{
  "schema_version": 1,
  "id": "probe-v2-tabela18",
  "workbook": {
    "path": "anexos/financeiro/carro chefe.xlsm",
    "expected_sha256": "b14b1e32c1774b1781847ab2afc97c8d504aec90a4a317bfccaa70293e2b977d",
    "expected_vba_sha256": "b8fa98985cdd1abd7d2d05b1cb7efabf79a8b83399136039dd040a4d6604b0cf"
  },
  "receipt_path": "anexos/financeiro/recipes/receipts/probe-v2-tabela18.receipt.json",
  "operations": [
    {
      "op": "dependency.assert_clean",
      "table": "Tabela18"
    },
    {
      "op": "table.rename",
      "table": "Tabela18",
      "new_name": "Tabela18V2Probe"
    }
  ]
}
