{"schema_version":1,"id":"bebidas-fort-2026-09-17","workbook":{"path":"anexos/financeiro/carro chefe.xlsm","expected_sha256":"62ceecb5d1349c4b27c37a901bae00aa1ac63884f5d5fe7f3990ad6f33073b70","expected_vba_sha256":"b8fa98985cdd1abd7d2d05b1cb7efabf79a8b83399136039dd040a4d6604b0cf"},"operations":[{"op":"assert.table","table":"insumos","expected_ref":"B4:K122","expected_columns":["ID","item","preço","quantidade","medida","Unidades","Quilos","Gramas","Litros","MLs"]},{"op":"assert.row","table":"insumos","where":{"ID":28},"equals":{"item":"Coca Cola 2,5","preço":{"value":"11.19"}}},{"op":"assert.row","table":"insumos","where":{"ID":29},"equals":{"item":"Coca Cola Lata 350","preço":{"value":"3.19"}}},{"op":"assert.row","table":"insumos","where":{"ID":30},"equals":{"item":"Coca Cola Zero Lata 350","preço":{"value":"3.89"}}},{"op":"assert.row","table":"insumos","where":{"ID":31},"equals":{"item":"Guaraná Lata 350","preço":{"value":"3.39"}}},{"op":"assert.row","table":"insumos","where":{"ID":32},"equals":{"item":"Funada 2","preço":{"value":"6.29"}}},{"op":"assert.row","table":"insumos","where":{"ID":33},"equals":{"item":"Original Garrafa 300","preço":{"value":"4.79"}}},{"op":"assert.row","table":"insumos","where":{"ID":34},"equals":{"item":"Brahma Chopp 350","preço":{"value":"3.99"}}},{"op":"assert.row","table":"insumos","where":{"ID":35},"equals":{"item":"Amstel 350","preço":{"value":"4.09"}}},{"op":"assert.row","table":"insumos","where":{"ID":36},"equals":{"item":"Heineken L.N 330","preço":{"value":"6.98"}}},{"op":"assert.row","table":"insumos","where":{"ID":37},"equals":{"item":"Skol 269","preço":{"value":"3.09"}}},{"op":"assert.row","table":"insumos","where":{"ID":38},"equals":{"item":"Coca Cola Zero 600","preço":{"value":"5.49"}}},{"op":"assert.row","table":"insumos","where":{"ID":40},"equals":{"item":"Fanta 2","preço":{"value":"9.49"}}},{"op":"table.update_rows","table":"insumos","where":{"ID":28},"values":{"preço":{"type":"decimal","value":"11.79"}}},{"op":"table.update_rows","table":"insumos","where":{"ID":29},"values":{"item":"Coca Cola Lata 310"}},{"op":"assert.table","table":"Ingredientes","expected_ref":"C4:I263","expected_columns":["Produto","ID","item","qtd.","medida","Porções","preço"]},{"op":"assert.cell","sheet":"ingredientes","cell":"C47","equals":null},{"op":"assert.cell","sheet":"ingredientes","cell":"E47","equals":null},{"op":"assert.cell","sheet":"ingredientes","cell":"F47","equals":null},{"op":"cell.set","sheet":"ingredientes","cell":"C47","value":"Coca-Cola Original PET 2,5 L"},{"op":"cell.set","sheet":"ingredientes","cell":"E47","value":"Coca Cola 2,5"},{"op":"cell.set","sheet":"ingredientes","cell":"F47","value":1},{"op":"assert.cell","sheet":"ingredientes","cell":"C48","equals":null},{"op":"assert.cell","sheet":"ingredientes","cell":"E48","equals":null},{"op":"assert.cell","sheet":"ingredientes","cell":"F48","equals":null},{"op":"cell.set","sheet":"ingredientes","cell":"C48","value":"Coca-Cola Original Lata 310 ml"},{"op":"cell.set","sheet":"ingredientes","cell":"E48","value":"Coca Cola Lata 310"},{"op":"cell.set","sheet":"ingredientes","cell":"F48","value":1},{"op":"assert.cell","sheet":"ingredientes","cell":"C49","equals":null},{"op":"assert.cell","sheet":"ingredientes","cell":"E49","equals":null},{"op":"assert.cell","sheet":"ingredientes","cell":"F49","equals":null},{"op":"cell.set","sheet":"ingredientes","cell":"C49","value":"Coca-Cola Zero Lata 350 ml"},{"op":"cell.set","sheet":"ingredientes","cell":"E49","value":"Coca Cola Zero Lata 350"},{"op":"cell.set","sheet":"ingredientes","cell":"F49","value":1},{"op":"assert.cell","sheet":"ingredientes","cell":"C50","equals":null},{"op":"assert.cell","sheet":"ingredientes","cell":"E50","equals":null},{"op":"assert.cell","sheet":"ingredientes","cell":"F50","equals":null},{"op":"cell.set","sheet":"ingredientes","cell":"C50","value":"Guaraná Antarctica Lata 350 ml"},{"op":"cell.set","sheet":"ingredientes","cell":"E50","value":"Guaraná Lata 350"},{"op":"cell.set","sheet":"ingredientes","cell":"F50","value":1},{"op":"assert.cell","sheet":"ingredientes","cell":"C51","equals":null},{"op":"assert.cell","sheet":"ingredientes","cell":"E51","equals":null},{"op":"assert.cell","sheet":"ingredientes","cell":"F51","equals":null},{"op":"cell.set","sheet":"ingredientes","cell":"C51","value":"Guaraná Funada PET 2 L"},{"op":"cell.set","sheet":"ingredientes","cell":"E51","value":"Funada 2"},{"op":"cell.set","sheet":"ingredientes","cell":"F51","value":1},{"op":"assert.cell","sheet":"ingredientes","cell":"C52","equals":null},{"op":"assert.cell","sheet":"ingredientes","cell":"E52","equals":null},{"op":"assert.cell","sheet":"ingredientes","cell":"F52","equals":null},{"op":"cell.set","sheet":"ingredientes","cell":"C52","value":"Cerveja Original Pilsen Garrafa 300 ml"},{"op":"cell.set","sheet":"ingredientes","cell":"E52","value":"Original Garrafa 300"},{"op":"cell.set","sheet":"ingredientes","cell":"F52","value":1},{"op":"assert.cell","sheet":"ingredientes","cell":"C53","equals":null},{"op":"assert.cell","sheet":"ingredientes","cell":"E53","equals":null},{"op":"assert.cell","sheet":"ingredientes","cell":"F53","equals":null},{"op":"cell.set","sheet":"ingredientes","cell":"C53","value":"Cerveja Brahma Chopp Pilsen Lata 350 ml"},{"op":"cell.set","sheet":"ingredientes","cell":"E53","value":"Brahma Chopp 350"},{"op":"cell.set","sheet":"ingredientes","cell":"F53","value":1},{"op":"assert.cell","sheet":"ingredientes","cell":"C54","equals":null},{"op":"assert.cell","sheet":"ingredientes","cell":"E54","equals":null},{"op":"assert.cell","sheet":"ingredientes","cell":"F54","equals":null},{"op":"cell.set","sheet":"ingredientes","cell":"C54","value":"Cerveja Amstel Puro Malte Lata 350 ml"},{"op":"cell.set","sheet":"ingredientes","cell":"E54","value":"Amstel 350"},{"op":"cell.set","sheet":"ingredientes","cell":"F54","value":1},{"op":"assert.cell","sheet":"ingredientes","cell":"C55","equals":null},{"op":"assert.cell","sheet":"ingredientes","cell":"E55","equals":null},{"op":"assert.cell","sheet":"ingredientes","cell":"F55","equals":null},{"op":"cell.set","sheet":"ingredientes","cell":"C55","value":"Cerveja Heineken Long Neck 330 ml"},{"op":"cell.set","sheet":"ingredientes","cell":"E55","value":"Heineken L.N 330"},{"op":"cell.set","sheet":"ingredientes","cell":"F55","value":1},{"op":"assert.cell","sheet":"ingredientes","cell":"C56","equals":null},{"op":"assert.cell","sheet":"ingredientes","cell":"E56","equals":null},{"op":"assert.cell","sheet":"ingredientes","cell":"F56","equals":null},{"op":"cell.set","sheet":"ingredientes","cell":"C56","value":"Cerveja Skol Pilsen Lata 269 ml"},{"op":"cell.set","sheet":"ingredientes","cell":"E56","value":"Skol 269"},{"op":"cell.set","sheet":"ingredientes","cell":"F56","value":1},{"op":"assert.cell","sheet":"ingredientes","cell":"C57","equals":null},{"op":"assert.cell","sheet":"ingredientes","cell":"E57","equals":null},{"op":"assert.cell","sheet":"ingredientes","cell":"F57","equals":null},{"op":"cell.set","sheet":"ingredientes","cell":"C57","value":"Coca-Cola Zero PET 600 ml"},{"op":"cell.set","sheet":"ingredientes","cell":"E57","value":"Coca Cola Zero 600"},{"op":"cell.set","sheet":"ingredientes","cell":"F57","value":1},{"op":"assert.cell","sheet":"ingredientes","cell":"C58","equals":null},{"op":"assert.cell","sheet":"ingredientes","cell":"E58","equals":null},{"op":"assert.cell","sheet":"ingredientes","cell":"F58","equals":null},{"op":"cell.set","sheet":"ingredientes","cell":"C58","value":"Fanta Laranja PET 2 L"},{"op":"cell.set","sheet":"ingredientes","cell":"E58","value":"Fanta 2"},{"op":"cell.set","sheet":"ingredientes","cell":"F58","value":1},{"op":"assert.table","table":"CaProdutos","expected_ref":"B4:M47","expected_columns":["ID","Item","Adicional 1","Adicional 2","Adicional 3","Variação","Tipo","Cat. ABC","Custo do Lote","Un. Por Lote","Custo de Produção (1 un.)","Custo Total (1 un.)"]},{"op":"table.upsert_rows","table":"CaProdutos","key":"ID","rows":[{"ID":32,"Item":"Coca-Cola Original PET 2,5 L","Un. Por Lote":1},{"ID":33,"Item":"Coca-Cola Original Lata 310 ml","Un. Por Lote":1},{"ID":34,"Item":"Coca-Cola Zero Lata 350 ml","Un. Por Lote":1},{"ID":35,"Item":"Guaraná Antarctica Lata 350 ml","Un. Por Lote":1},{"ID":36,"Item":"Guaraná Funada PET 2 L","Un. Por Lote":1},{"ID":37,"Item":"Cerveja Original Pilsen Garrafa 300 ml","Un. Por Lote":1},{"ID":38,"Item":"Cerveja Brahma Chopp Pilsen Lata 350 ml","Un. Por Lote":1},{"ID":39,"Item":"Cerveja Amstel Puro Malte Lata 350 ml","Un. Por Lote":1},{"ID":40,"Item":"Cerveja Heineken Long Neck 330 ml","Un. Por Lote":1},{"ID":41,"Item":"Cerveja Skol Pilsen Lata 269 ml","Un. Por Lote":1},{"ID":42,"Item":"Coca-Cola Zero PET 600 ml","Un. Por Lote":1},{"ID":43,"Item":"Fanta Laranja PET 2 L","Un. Por Lote":1}]},{"op":"assert.table","table":"Precificação","expected_ref":"B4:I42","expected_columns":["ID","Item","Preço de Custo","Preço de Venda","Preço Definitivo","Lucro Bruto","Lucro Líquido","Incluir C.F?"]},{"op":"cell.set","sheet":"Precificação","cell":"I30","value":"Não"},{"op":"cell.set","sheet":"Precificação","cell":"I31","value":"Não"},{"op":"cell.set","sheet":"Precificação","cell":"I32","value":"Não"},{"op":"cell.set","sheet":"Precificação","cell":"I33","value":"Não"},{"op":"cell.set","sheet":"Precificação","cell":"I34","value":"Não"},{"op":"cell.set","sheet":"Precificação","cell":"I35","value":"Não"},{"op":"cell.set","sheet":"Precificação","cell":"I36","value":"Não"},{"op":"cell.set","sheet":"Precificação","cell":"I37","value":"Não"},{"op":"cell.set","sheet":"Precificação","cell":"I38","value":"Não"},{"op":"cell.set","sheet":"Precificação","cell":"I39","value":"Não"},{"op":"cell.set","sheet":"Precificação","cell":"I40","value":"Não"},{"op":"cell.set","sheet":"Precificação","cell":"I41","value":"Não"},{"op":"workbook.recalculate_on_open"}]}